APP,CVE ID,Spanish Description,English Description,AccessVector,Attack Complexity,Confidentiality Impact,Integrity Impact,Availability Impact,Base Score,Base Severity,Exploitability Score,Impact Score,Version End Excluding,Version End Including
WhatsApp,CVE-2017-8769,"** EN DISPUTA ** Facebook WhatsApp Messenger 2.17.146 para Android utiliza la tarjeta SD para el almacenamiento en archivos en texto claro (audio, documentos, imágenes, vídeos y notas de voz) asociados a una conversación incluso si se elimina dicha conversación. Puede haber usuarios que esperen que se realice el borrado de estos archivos una vez que se elimina la conversación o usuarios que esperen que estos archivos estén cifrados (de acuerdo al uso por parte de la aplicación de una base de datos cifrada para almacenar los textos de conversaciones). NOTA: el fabricante indica que no \""considera que esto se trate de problemas de seguridad\"" debido a que un usuario, de forma legítima, puede querer preservar cualquier archivo para su uso \""en otras apps como la galería de Google Photos\"", independientemente de si la conversación asociada se ha eliminado o no.","Facebook WhatsApp Messenger before 2.16.323 for Android uses the SD card for cleartext storage of files (Audio, Documents, Images, Video, and Voice Notes) associated with a chat, even after that chat is deleted. There may be users who expect file deletion to occur upon chat deletion, or who expect encryption (consistent with the application's use of an encrypted database to store chat text). NOTE: the vendor reportedly indicates that they do not ""consider these to be security issues"" because a user may legitimately want to preserve any file for use ""in other apps like the Google Photos gallery"" regardless of whether its associated chat is deleted",PHYSICAL,LOW,HIGH,NONE,NONE,4.6,MEDIUM,NULL,NULL,2.16.323,
WhatsApp,CVE-2018-6344,Una corrupción basada en memoria (heap) en WhatsApp puede deberse a un paquete RTP mal formado que se envía tras el establecimiento de una llamada. Esta vulnerabilidad puede utilizarse para provocar una denegación de servicio. Afecta a WhatsApp para Android en versiones anteriores a la v2.18.293 WhatsApp para iOS en versiones anteriores a la v2.18.93 y WhatsApp for Windows Phone en versiones anteriores a la v2.18.172.,"A heap corruption in WhatsApp can be caused by a malformed RTP packet being sent after a call is established. The vulnerability can be used to cause denial of service. It affects WhatsApp for Android prior to v2.18.293, WhatsApp for iOS prior to v2.18.93, and WhatsApp for Windows Phone prior to v2.18.172.",NETWORK,LOW,NONE,NONE,HIGH,7.5,HIGH,NULL,NULL,2.18.293,
WhatsApp,CVE-2019-3568,"Una vulnerabilidad de desbordamiento de búfer en la pila VOIP de WhatsApp permitió la ejecución remota de código a través de una serie de paquetes RTCP especialmente diseñados que se enviaron a un número de teléfono de destino. El problema afecta a WhatsApp para Android anterior a v2.19.134, WhatsApp Business para Android anterior a v2.19.44, WhatsApp para iOS anterior a v2.19.51, WhatsApp Business para iOS anterior a v2.19.51, WhatsApp para Windows Phone antes de v2.18.348 , y WhatsApp para Tizen antes de v2.18.15.","A buffer overflow vulnerability in WhatsApp VOIP stack allowed remote code execution via specially crafted series of RTCP packets sent to a target phone number. The issue affects WhatsApp for Android prior to v2.19.134, WhatsApp Business for Android prior to v2.19.44, WhatsApp for iOS prior to v2.19.51, WhatsApp Business for iOS prior to v2.19.51, WhatsApp for Windows Phone prior to v2.18.348, and WhatsApp for Tizen prior to v2.18.15.",NETWORK,LOW,PARTIAL,PARTIAL,PARTIAL,7.5,HIGH,NULL,NULL,2.19.44,
WhatsApp,CVE-2018-6349,"Al recibir llamadas usando WhatsApp para Android, una falta de comprobación de tamaño cuando se analizan un paquete proporcionado por el remitente permite un desbordamiento basado en la pila. Este problema afecta a WhatsApp para Android anterior a versión 2.18.248 y WhatsApp Business para Android anterior a versión 2.18.132.","When receiving calls using WhatsApp for Android, a missing size check when parsing a sender-provided packet allowed for a stack-based overflow. This issue affects WhatsApp for Android prior to 2.18.248 and WhatsApp Business for Android prior to 2.18.132.",NETWORK,LOW,HIGH,HIGH,HIGH,9.8,CRITICAL,NULL,NULL,2.18.132,
WhatsApp,CVE-2018-6350,"Fue posible una lectura fuera de límites en WhatsApp debido a un análisis incorrecto de los encabezados de extensión RTP. Este problema afecta a WhatsApp para Android anterior a versión 2.18.276, WhatsApp Business para Android anterior a versión 2.18.99, WhatsApp para iOS anterior a versión 2.18.100.6, WhatsApp Business para iOS anterior a versión 2.18.100.2 y WhatsApp para Windows Phone anterior a versión 2.18. 224.","An out-of-bounds read was possible in WhatsApp due to incorrect parsing of RTP extension headers. This issue affects WhatsApp for Android prior to 2.18.276, WhatsApp Business for Android prior to 2.18.99, WhatsApp for iOS prior to 2.18.100.6, WhatsApp Business for iOS prior to 2.18.100.2, and WhatsApp for Windows Phone prior to 2.18.224.",NETWORK,LOW,PARTIAL,PARTIAL,PARTIAL,7.5,HIGH,NULL,NULL,2.18.99,
WhatsApp,CVE-2019-11927,Un desbordamiento de enteros en las bibliotecas de análisis multimedia de WhatsApp permite a un atacante remoto llevar a cabo una escritura fuera de límite en el pila por medio de etiquetas EXIF especialmente diseñadas en imágenes WEBP. Este problema afecta a WhatsApp para Android anterior a la versión 2.19.143 y WhatsApp para iOS anterior a la versión 2.19.100.,An integer overflow in WhatsApp media parsing libraries allows a remote attacker to perform an out-of-bounds write on the heap via specially-crafted EXIF tags in WEBP images. This issue affects WhatsApp for Android before version 2.19.143 and WhatsApp for iOS before version 2.19.100.,LOCAL,LOW,HIGH,HIGH,HIGH,7.8,HIGH,NULL,NULL,2.9.143,
WhatsApp,CVE-2019-11932,"Una vulnerabilidad doble gratuita en la función DDGifSlurp en decoding.c en la biblioteca android-gif-drawable antes de la versión 1.2.18, como se usa en WhatsApp para Android antes de la versión 2.19.244 y muchas otras aplicaciones de Android, permite a los atacantes remotos ejecutar código arbitrario o causar una denegación de servicio cuando la biblioteca se utiliza para analizar una imagen GIF especialmente diseñada.","A double free vulnerability in the DDGifSlurp function in decoding.c in the android-gif-drawable library before version 1.2.18, as used in WhatsApp for Android before version 2.19.244 and many other Android applications, allows remote attackers to execute arbitrary code or cause a denial of service when the library is used to parse a specially crafted GIF image.",NETWORK,LOW,HIGH,HIGH,HIGH,8.8,HIGH,NULL,NULL,2.19.244,
WhatsApp,CVE-2019-11933,"Un error de desbordamiento del búfer de la pila en libpl_droidsonroids_gif antes del 1.2.19, como es usado en WhatsApp para Android anteriores a la versión 2.19.291, podría permitir a atacantes remotos ejecutar código arbitrario o causar una denegación de servicio.","A heap buffer overflow bug in libpl_droidsonroids_gif before 1.2.19, as used in WhatsApp for Android before version 2.19.291 could allow remote attackers to execute arbitrary code or cause a denial of service.",NETWORK,LOW,HIGH,HIGH,HIGH,9.8,CRITICAL,NULL,NULL,2.19.291,
WhatsApp,CVE-2019-11931,"Se podría desencadenar un desbordamiento de búfer en la región heap de la memoria en WhatsApp mediante el envío de un archivo MP4 especialmente diseñado hacia un usuario de WhatsApp. El problema estaba presente en el análisis de los metadatos de flujo elemental de un archivo MP4 y podría resultar en un DoS o RCE. Esto afecta a Android versiones anteriores a la versión 2.19.274, iOS versiones anteriores a la versión 2.19.100, Enterprise Client versiones anteriores a la versión 2.25.3, Business for Android versiones anteriores a 2.19.104 y Business for iOS versiones anteriores a 2.19.100.","A stack-based buffer overflow could be triggered in WhatsApp by sending a specially crafted MP4 file to a WhatsApp user. The issue was present in parsing the elementary stream metadata of an MP4 file and could result in a DoS or RCE. This affects Android versions prior to 2.19.274, iOS versions prior to 2.19.100, Enterprise Client versions prior to 2.25.3, Business for Android versions prior to 2.19.104 and Business for iOS versions prior to 2.19.100.",LOCAL,LOW,HIGH,HIGH,HIGH,7.8,HIGH,NULL,NULL,2.19.274,
WhatsApp,CVE-2020-1886,"Un desbordamiento del búfer en WhatsApp para Android versiones anteriores a v2.20.11 y WhatsApp Business para Android versiones anteriores a v2.20.2, podría haber permitido una escritura fuera de límites por medio de una transmisión de video especialmente diseñada después de recibir y responder una videollamada maliciosa",A buffer overflow in WhatsApp for Android prior to v2.20.11 and WhatsApp Business for Android prior to v2.20.2 could have allowed an out-of-bounds write via a specially crafted video stream after receiving and answering a malicious video call.,NETWORK,LOW,HIGH,HIGH,HIGH,8.8,HIGH,NULL,NULL,2.20.11,
WhatsApp,CVE-2020-1890,"Un problema de comprobación de URL en WhatsApp para Android versiones anteriores a v2.20.11 y WhatsApp Business para Android versiones anteriores a v2.20.2, podría haber causado que el destinatario de un mensaje sticker que contenía datos deliberadamente malformados cargara una imagen desde una URL controlada por el remitente sin interacción del usuario",A URL validation issue in WhatsApp for Android prior to v2.20.11 and WhatsApp Business for Android prior to v2.20.2 could have caused the recipient of a sticker message containing deliberately malformed data to load an image from a sender-controlled URL without user interaction.,NETWORK,LOW,NONE,HIGH,NONE,7.5,HIGH,NULL,NULL,2.20.11,
WhatsApp,CVE-2020-1891,"Un parámetro controlado por usuario usado en videollamada en WhatsApp para Android versiones anteriores a v2.20.17, WhatsApp Business para Android versiones anteriores a v2.20.7, WhatsApp para iPhone versiones anteriores a v2.20.20 y WhatsApp Business para iPhone versiones anteriores a v2.20.20, podría haber permitido una escritura fuera de límites en dispositivos de 32 bits","A user controlled parameter used in video call in WhatsApp for Android prior to v2.20.17, WhatsApp Business for Android prior to v2.20.7, WhatsApp for iPhone prior to v2.20.20, and WhatsApp Business for iPhone prior to v2.20.20 could have allowed an out-of-bounds write on 32-bit devices.",NETWORK,LOW,HIGH,HIGH,HIGH,9.8,CRITICAL,NULL,NULL,2.20.17,
WhatsApp,CVE-2020-1894,"Un desbordamiento de escritura de pila en WhatsApp para Android versiones anteriores a v2.20.35, WhatsApp Business para Android versiones anteriores a v2.20.20, WhatsApp para iPhone versiones anteriores a v2.20.30 y WhatsApp Business para iPhone versiones anteriores a v2.20.30, podría haber permitido una ejecución de código arbitraria cuando se reproduce un mensaje push to talk especialmente diseñado","A stack write overflow in WhatsApp for Android prior to v2.20.35, WhatsApp Business for Android prior to v2.20.20, WhatsApp for iPhone prior to v2.20.30, and WhatsApp Business for iPhone prior to v2.20.30 could have allowed arbitrary code execution when playing a specially crafted push to talk message.",NETWORK,LOW,HIGH,HIGH,HIGH,8.8,HIGH,NULL,NULL,2.20.35,
WhatsApp,CVE-2020-1905,"Los URI de Media ContentProvider usados para abrir archivos adjuntos en otras aplicaciones se generaron secuencialmente antes de WhatsApp para Android versión v2.20.185, lo que podría haber permitido que una aplicación de terceros maliciosa elegida para abrir el archivo adivine los URI de los archivos adjuntos abiertos previamente hasta que la aplicación de apertura sea finalizada","Media ContentProvider URIs used for opening attachments in other apps were generated sequentially prior to WhatsApp for Android v2.20.185, which could have allowed a malicious third party app chosen to open the file to guess the URIs for previously opened attachments until the opener app is terminated.",LOCAL,LOW,LOW,NONE,NONE,3.3,LOW,NULL,NULL,2.20.185,
WhatsApp,CVE-2020-1906,"Un desbordamiento de búfer en WhatsApp para Android anterior a versión v2.20.130 y WhatsApp Business para Android anterior a versión v2.20.46, podría haber permitido una escritura fuera de límites al procesar videos locales malformados con transmisiones de audio E-AC-3",A buffer overflow in WhatsApp for Android prior to v2.20.130 and WhatsApp Business for Android prior to v2.20.46 could have allowed an out-of-bounds write when processing malformed local videos with E-AC-3 audio streams.,LOCAL,LOW,HIGH,HIGH,HIGH,7.8,HIGH,NULL,NULL,2.20.130,
WhatsApp,CVE-2020-1907,"Un desbordamiento de pila en WhatsApp para Android anterior a versión v2.20.196.16, WhatsApp Business para Android anterior a versión v2.20.196.12, WhatsApp para iOS anterior a versión v2.20.90, WhatsApp Business para iOS anterior a versión v2.20.90 y WhatsApp para Portal anterior a versión v173.0.0.29.505, podría haber permitido una ejecución de código arbitrario cuando analiza el contenido de un encabezado RTP Extension","A stack overflow in WhatsApp for Android prior to v2.20.196.16, WhatsApp Business for Android prior to v2.20.196.12, WhatsApp for iOS prior to v2.20.90, WhatsApp Business for iOS prior to v2.20.90, and WhatsApp for Portal prior to v173.0.0.29.505 could have allowed arbitrary code execution when parsing the contents of an RTP Extension header.",NETWORK,LOW,HIGH,HIGH,HIGH,9.8,CRITICAL,NULL,NULL,2.20.196.16,
WhatsApp,CVE-2020-1910,"Una falta de comprobación de límites en WhatsApp para Android anterior a la v2.21.1.13 y WhatsApp Business para Android anterior a la versión v2.21.1.13, podría haber permitido la lectura y escritura fuera de límites si un usuario aplicaba filtros de imagen específicos a una imagen especialmente diseñada y enviar la imagen resultante",A missing bounds check in WhatsApp for Android prior to v2.21.1.13 and WhatsApp Business for Android prior to v2.21.1.13 could have allowed out-of-bounds read and write if a user applied specific image filters to a specially crafted image and sent the resulting image.,LOCAL,LOW,HIGH,HIGH,HIGH,7.8,HIGH,NULL,NULL,2.21.1.13,
WhatsApp,CVE-2021-24026,"Una falta de comprobación de límites dentro de la tubería de decodificación de audio para llamadas de WhatsApp en WhatsApp para Android versiones anteriores a v2.21.3, WhatsApp Business para Android versiones anteriores a v2.21.3, WhatsApp para iOS versiones anteriores a v2.21.32 y WhatsApp Business para iOS versiones anteriores a v2. 21.32, podría haber permitido una escritura fuera de límites","A missing bounds check within the audio decoding pipeline for WhatsApp calls in WhatsApp for Android prior to v2.21.3, WhatsApp Business for Android prior to v2.21.3, WhatsApp for iOS prior to v2.21.32, and WhatsApp Business for iOS prior to v2.21.32 could have allowed an out-of-bounds write.",NETWORK,LOW,HIGH,HIGH,HIGH,9.8,CRITICAL,NULL,NULL,2.21.3,
WhatsApp,CVE-2021-24027,"Un problema de configuración de caché anterior a WhatsApp para Android versión v2.21.4.18 y WhatsApp Business para Android versión v2.21.4.18, puede haber permitido a un tercero con acceso al almacenamiento externo del dispositivo leer material TLS almacenado en caché",A cache configuration issue prior to WhatsApp for Android v2.21.4.18 and WhatsApp Business for Android v2.21.4.18 may have allowed a third party with access to the device’s external storage to read cached TLS material.,NETWORK,LOW,HIGH,NONE,NONE,7.5,HIGH,NULL,NULL,2.21.4.18,
WhatsApp,CVE-2021-24041,Una comprobación de límites faltante en el código de desenfoque de imágenes anterior a WhatsApp para Android v2.21.22.7 y WhatsApp Business para Android v2.21.22.7 podría haber permitido una escritura fuera de límites si un usuario enviaba una imagen maliciosa,A missing bounds check in image blurring code prior to WhatsApp for Android v2.21.22.7 and WhatsApp Business for Android v2.21.22.7 could have allowed an out-of-bounds write if a user sent a malicious image.,NETWORK,LOW,HIGH,HIGH,HIGH,9.8,CRITICAL,NULL,NULL,2.21.22.7,
WhatsApp,CVE-2020-20096,"Whatsapp iOS 2.19.80 y anteriores y Android 2.19.222 y versiones anteriores de interfaz de usuario, no representa apropiadamente los mensajes URI al usuario, lo que resulta en una suplantación de URI por medio de mensajes especialmente diseñados","Whatsapp iOS 2.19.80 and prior and Android 2.19.222 and prior user interface does not properly represent URI messages to the user, which results in URI spoofing via specially crafted messages.",NETWORK,LOW,NONE,HIGH,NONE,6.5,MEDIUM,NULL,NULL,,2.19.222
WhatsApp,CVE-2022-27492,Un desbordamiento de enteros en WhatsApp podría haber causado una ejecución de código remota cuando es recibido un archivo de vídeo diseñado.,An integer underflow in WhatsApp could have caused remote code execution when receiving a crafted video file.,LOCAL,LOW,HIGH,HIGH,HIGH,7.8,HIGH,NULL,NULL,2.22.16.2,
Instagram,CVE-2020-1895,Podría presentarse un desbordamiento grande de la pila en Instagram para Android cuando se intenta cargar una imagen con dimensiones especialmente diseñadas. Esto afecta a las versiones anteriores a 128.0.0.26.128.,A large heap overflow could occur in Instagram for Android when attempting to upload an image with specially crafted dimensions. This affects versions prior to 128.0.0.26.128.,LOCAL,LOW,HIGH,HIGH,HIGH,7.8,HIGH,NULL,NULL,128.0.0.26.128,
Instagram,CVE-2020-20094,"Instagram iOS para iOS versiones 106.0 y anteriores y para Android versiones 107.0.0.11 y versiones anteriores de interfaz de usuario, no representa apropiadamente los mensajes URI para el usuario, lo que resulta en una suplantación de URI por medio de mensajes especialmente diseñados","Instagram iOS 106.0 and prior and Android 107.0.0.11 and prior user interface does not properly represent URI messages to the user, which results in URI spoofing via specially crafted messages",NETWORK,LOW,NONE,HIGH,NONE,6.5,MEDIUM,NULL,NULL,,107.0.0.11
Chrome,CVE-2014-3159,"La función WebContentsDelegateAndroid::OpenURLFromTab en components/web_contents_delegate_android/web_contents_delegate_android.cc en Google Chrome anterior a 36.0.1985.122 en Android no restringe debidamente la carga de URLs, lo que permite a atacantes remotos falsificar la URL en el Omnibox a través de vectores no especificados.","The WebContentsDelegateAndroid::OpenURLFromTab function in components/web_contents_delegate_android/web_contents_delegate_android.cc in Google Chrome before 36.0.1985.122 on Android does not properly restrict URL loading, which allows remote attackers to spoof the URL in the Omnibox via unspecified vectors.",NETWORK,LOW,PARTIAL,PARTIAL,NONE,6.4,MEDIUM,NULL,NULL,,36.0.1985.106
Chrome,CVE-2014-3161,"La función WebMediaPlayerAndroid::load en content/renderer/media/android/webmediaplayer_android.cc en Google Chrome anterior a 36.0.1985.122 en Android no interactúa debidamente con las redirecciones, lo que permite a atacantes remotos evadir Same Origin Policy a través de un sitio web manipulado que hospeda un flujo de vídeo.","The WebMediaPlayerAndroid::load function in content/renderer/media/android/webmediaplayer_android.cc in Google Chrome before 36.0.1985.122 on Android does not properly interact with redirects, which allows remote attackers to bypass the Same Origin Policy via a crafted web site that hosts a video stream.",NETWORK,LOW,PARTIAL,PARTIAL,PARTIAL,7.5,HIGH,NULL,NULL,,36.0.1985.106
Chrome,CVE-2014-3201,"core/rendering/compositing/RenderLayerCompositor.cpp en Blink, utilizado en Google Chrome anterior a 38.0.2125.102 en Android, no maneja debidamente cierta condición de desbordamiento de IFRAME, lo que permite a atacantes remotos falsificar contenido a través de un sitio web manipulado que interfiere con la barra de desplazamiento.","core/rendering/compositing/RenderLayerCompositor.cpp in Blink, as used in Google Chrome before 38.0.2125.102 on Android, does not properly handle a certain IFRAME overflow condition, which allows remote attackers to spoof content via a crafted web site that interferes with the scrollbar.",NETWORK,LOW,NONE,PARTIAL,NONE,5.0,MEDIUM,NULL,NULL,,38.0.2125.101
Chrome,CVE-2014-7905,"Google Chrome anterior a 39.0.2171.65 para Android no previene la navegación a una URL en los casos donde una intento para la URL no tiene CATEGORY_BROWSABLE, lo que permite a atacantes remotos evadir las restricciones de acceso a través de un sitio web manipulado.","Google Chrome before 39.0.2171.65 on Android does not prevent navigation to a URL in cases where an intent for the URL lacks CATEGORY_BROWSABLE, which allows remote attackers to bypass intended access restrictions via a crafted web site.",NETWORK,LOW,NONE,PARTIAL,NONE,5.0,MEDIUM,NULL,NULL,,39.0.2171.45
Chrome,CVE-2015-1209,"Vulnerabilidad de uso después de liberación en la función VisibleSelection::nonBoundaryShadowTreeRootNode en core/editing/VisibleSelection.cpp en la implementación DOM en Blink, utilizado en Google Chrome anterior a 40.0.2214.111 en Windows, OS X, y Linux y anterior a 40.0.2214.109 en Android, permite a atacantes remotos causar una denegación de servicio o posiblemente tener otro impacto no especificado a través de código JavaScript manipulado que provoca el manejo incorrecto de una ancla shadow-root.","Use-after-free vulnerability in the VisibleSelection::nonBoundaryShadowTreeRootNode function in core/editing/VisibleSelection.cpp in the DOM implementation in Blink, as used in Google Chrome before 40.0.2214.111 on Windows, OS X, and Linux and before 40.0.2214.109 on Android, allows remote attackers to cause a denial of service or possibly have unspecified other impact via crafted JavaScript code that triggers improper handling of a shadow-root anchor.",NETWORK,LOW,PARTIAL,PARTIAL,PARTIAL,7.5,HIGH,NULL,NULL,40.0.2214.109,
Chrome,CVE-2015-1210,"La función V8ThrowException::createDOMException en bindings/core/v8/V8ThrowException.cpp en las vinculaciones V8 en Blink, utilizado en Google Chrome anterior a 40.0.2214.111 en Windows, OS X, y Linux y anterior a 40.0.2214.109 en Android, no considera correctamente las restricciones de acceso a Frame durante el lanzamiento de una excepción, lo que permite a atacantes remotos evadir Same Origin Policy a través de un sitio web manipulado.","The V8ThrowException::createDOMException function in bindings/core/v8/V8ThrowException.cpp in the V8 bindings in Blink, as used in Google Chrome before 40.0.2214.111 on Windows, OS X, and Linux and before 40.0.2214.109 on Android, does not properly consider frame access restrictions during the throwing of an exception, which allows remote attackers to bypass the Same Origin Policy via a crafted web site.",NETWORK,LOW,NONE,PARTIAL,NONE,5.0,MEDIUM,NULL,NULL,40.0.2214.109,
Chrome,CVE-2015-1211,"La función OriginCanAccessServiceWorkers en content/browser/service_worker/service_worker_dispatcher_host.cc en Google Chrome anterior a 40.0.2214.111 en Windows, OS X, y Linux y anterior a 40.0.2214.109 en Android no restringe correctamente la esquema de la URI durante un registro Serviceworker, lo que permite a atacantes remotos ganar privilegios a través de una URI filesystem:.","The OriginCanAccessServiceWorkers function in content/browser/service_worker/service_worker_dispatcher_host.cc in Google Chrome before 40.0.2214.111 on Windows, OS X, and Linux and before 40.0.2214.109 on Android does not properly restrict the URI scheme during a ServiceWorker registration, which allows remote attackers to gain privileges via a filesystem: URI.",NETWORK,LOW,PARTIAL,PARTIAL,PARTIAL,7.5,HIGH,NULL,NULL,40.0.2214.109,
Chrome,CVE-2015-1212,"Múltiples vulnerabilidades no especificados en Google Chrome before 40.0.2214.111 en Windows, OS X, y Linux y anterior a 40.0.2214.109 en Android permiten a atacantes causar una denegación de servicio o posiblemente tener otro impacto a través de vectores desconocidos.","Multiple unspecified vulnerabilities in Google Chrome before 40.0.2214.111 on Windows, OS X, and Linux and before 40.0.2214.109 on Android allow attackers to cause a denial of service or possibly have other impact via unknown vectors.",NETWORK,LOW,PARTIAL,PARTIAL,PARTIAL,7.5,HIGH,NULL,NULL,40.0.2214.109,
Chrome,CVE-2015-1261,"android/java/src/org/chromium/chrome/browser/WebsiteSettingsPopup.java en Google Chrome anterior a 43.0.2357.65 en Android no restringe correctamente el uso de el identificador de fragmentos de una URL durante la construcción de una página emergente de información, lo que permite a atacantes remotos falsificar la barra de la URL o entregar contenidos de emergentes engañosos a través de un texto manipulado.","android/java/src/org/chromium/chrome/browser/WebsiteSettingsPopup.java in Google Chrome before 43.0.2357.65 on Android does not properly restrict use of a URL's fragment identifier during construction of a page-info popup, which allows remote attackers to spoof the URL bar or deliver misleading popup content via crafted text.",NETWORK,LOW,NONE,PARTIAL,NONE,5.0,MEDIUM,NULL,NULL,,42.0.2311.107
