APP,CVE ID,Spanish Description,English Description,AccessVector,Attack Complexity,Confidentiality Impact,Integrity Impact,Availability Impact,Base Score,Base Severity,Exploitability Score,Impact Score,Version End Excluding,Version End Including
Firefox,CVE-2020-15666,"Cuando se intenta cargar un archivo que no es de video en un contexto de audio y video, el código de estado exacto (200, 302, 404, 500, 412, 403, etc.) fue revelado por medio del MediaError Message.&#xa0;Este nivel de filtración de información es inconsistente con la divulgación estandarizada onerror/onsuccess y puede conllevar a inferir el estado de inicio de sesión a los servicios o a la detección de dispositivos en una red local, entre otros ataques.&#xa0;Esta vulnerabilidad afecta a Firefox versiones anteriores a 80 y Firefox para Android versiones anteriores a 80","When trying to load a non-video in an audio/video context the exact status code (200, 302, 404, 500, 412, 403, etc.) was disclosed via the MediaError Message. This level of information leakage is inconsistent with the standardized onerror/onsuccess disclosure and can lead to inferring login status to services or device discovery on a local network among other attacks. This vulnerability affects Firefox < 80 and Firefox for Android < 80.",NETWORK,LOW,HIGH,NONE,NONE,6.5,MEDIUM,NULL,NULL,80.0,
Firefox,CVE-2020-15668,Un candado esta faltando al acceder a una estructura de datos e importar información del certificado hacia la base de datos confiable.&#xa0;Esta vulnerabilidad afecta a Firefox versiones anteriores a 80 y Firefox para Android versiones anteriores a 80,A lock was missing when accessing a data structure and importing certificate information into the trust database. This vulnerability affects Firefox < 80 and Firefox for Android < 80.,NETWORK,LOW,LOW,NONE,NONE,4.3,MEDIUM,NULL,NULL,80.0,
Firefox,CVE-2020-15670,"Los desarrolladores de Mozilla reportaron de unos bugs de seguridad de la memoria presentes en Firefox para Android versión 79. Algunos de estos bugs han mostrado evidencia de corrupción de la memoria y suponemos que con suficiente esfuerzo algunos de ellos podrían haber sido explotados para ejecutar código arbitrario.&#xa0;Esta vulnerabilidad afecta a Firefox versiones anteriores a 80, Firefox ESR versiones anteriores a 78.2, Thunderbird versiones anteriores a 78.2 y Firefox para Android versiones anteriores a 80","Mozilla developers reported memory safety bugs present in Firefox for Android 79. Some of these bugs showed evidence of memory corruption and we presume that with enough effort some of these could have been exploited to run arbitrary code. This vulnerability affects Firefox < 80, Firefox ESR < 78.2, Thunderbird < 78.2, and Firefox for Android < 80.",NETWORK,LOW,HIGH,HIGH,HIGH,8.8,HIGH,NULL,NULL,80.0,
Firefox,CVE-2020-15671,"Cuando se escribe una contraseña bajo determinadas condiciones, es posible que se haya producido una carrera en la que InputContext no estaba siendo ajustado correctamente para el campo de entrada, resultando en que la contraseña escrita se guardada en el diccionario del teclado.&#xa0;Esta vulnerabilidad afecta a Firefox para Android versiones anteriores a 80","When typing in a password under certain conditions, a race may have occured where the InputContext was not being correctly set for the input field, resulting in the typed password being saved to the keyboard dictionary. This vulnerability affects Firefox for Android < 80.",NETWORK,HIGH,LOW,NONE,NONE,3.1,LOW,NULL,NULL,80.0,
Firefox,CVE-2020-12400,"Cuando se convierten coordenadas desde una descriptiva a afín, la inversión modular no se llevó a cabo en un tiempo constante, resultando en un posible ataque de canal lateral basado en sincronización.&#xa0;Esta vulnerabilidad afecta a Firefox versiones anteriores a 80 y Firefox para Android versiones anteriores a 80","When converting coordinates from projective to affine, the modular inversion was not performed in constant time, resulting in a possible timing-based side channel attack. This vulnerability affects Firefox < 80 and Firefox for Android < 80.",LOCAL,HIGH,HIGH,NONE,NONE,4.7,MEDIUM,NULL,NULL,80.0,
Firefox,CVE-2020-12401,"Durante la generación de firmas ECDSA, fue removido el relleno aplicado en el nonce diseñado para asegurar la multiplicación escalar de tiempo constante, resultando en una ejecución de tiempo variable dependiente de datos secretos.&#xa0;Esta vulnerabilidad afecta a Firefox versiones anteriores a 80 y Firefox para Android versiones anteriores a 80","During ECDSA signature generation, padding applied in the nonce designed to ensure constant-time scalar multiplication was removed, resulting in variable-time execution dependent on secret data. This vulnerability affects Firefox < 80 and Firefox for Android < 80.",LOCAL,HIGH,HIGH,NONE,NONE,4.7,MEDIUM,NULL,NULL,80.0,
Firefox,CVE-2020-6829,"Cuando se lleva a cabo la multiplicación de puntos escalares EC, se usó el algoritmo de multiplicación de puntos wNAF;&#xa0;que filtró información parcial sobre el nonce usado durante la generación de firmas.&#xa0;Dado un rastro electromagnético de unas pocas generaciones de firmas, la clave privada podría haberse calculado.&#xa0;Esta vulnerabilidad afecta a Firefox versiones anteriores a 80 y Firefox para Android versiones anteriores a 80","When performing EC scalar point multiplication, the wNAF point multiplication algorithm was used; which leaked partial information about the nonce used during signature generation. Given an electro-magnetic trace of a few signature generations, the private key could have been computed. This vulnerability affects Firefox < 80 and Firefox for Android < 80.",NETWORK,LOW,LOW,NONE,NONE,5.3,MEDIUM,NULL,NULL,80.0,
Firefox,CVE-2020-26954,"Al aceptar un intent malicioso de otras aplicaciones instaladas, Firefox para Android aceptó manifiestos de rutas de archivo arbitrarias y permitió declarar manifiestos de aplicaciones web para otros orígenes. Esto podría ser usado para conseguir acceso a la pantalla completa para la suplantación de identidad y también podría conllevar a ataques de tipo cross-origin en sitios web específicos. *Nota: Este problema sólo afectaba a Firefox para Android. Otros sistemas operativos no están afectados. Esta vulnerabilidad afecta a Firefox versiones anteriores a 83","When accepting a malicious intent from other installed apps, Firefox for Android accepted manifests from arbitrary file paths and allowed declaring webapp manifests for other origins. This could be used to gain fullscreen access for UI spoofing and could also lead to cross-origin attacks on targeted websites. *Note: This issue only affected Firefox for Android. Other operating systems are unaffected.*. This vulnerability affects Firefox < 83.",NETWORK,LOW,NONE,LOW,NONE,4.3,MEDIUM,NULL,NULL,83.0,
Firefox,CVE-2020-26955,"Cuando un usuario descargaba un archivo en Firefox para Android, si una cookie es ajustada, ésta habría sido reenviada durante una operación posterior de descarga de archivos en el mismo dominio, independientemente de si la petición original y posterior se encontraban en modos de navegación privados y no privados. *Nota: Este problema sólo afectaba a Firefox para Android. Los demás sistemas operativos no están afectados.*. Esta vulnerabilidad afecta a Firefox versiones anteriores a 83","When a user downloaded a file in Firefox for Android, if a cookie is set, it would have been re-sent during a subsequent file download operation on the same domain, regardless of whether the original and subsequent request were in private and non-private browsing modes. *Note: This issue only affected Firefox for Android. Other operating systems are unaffected.*. This vulnerability affects Firefox < 83.",NETWORK,LOW,NONE,HIGH,NONE,6.5,MEDIUM,NULL,NULL,83.0,
Firefox,CVE-2020-26957,OneCRL no funcionaba en el nuevo Firefox para Android debido a una falta de inicialización del servicio. Esto podría resultar en un fallo en la aplicación de algunas revocaciones de certificados. *Nota: Este problema sólo afectaba a Firefox para Android. Otros sistemas operativos no están afectados.* Esta vulnerabilidad afecta a Firefox versiones anteriores a 83,OneCRL was non-functional in the new Firefox for Android due to a missing service initialization. This could result in a failure to enforce some certificate revocations. *Note: This issue only affected Firefox for Android. Other operating systems are unaffected.*. This vulnerability affects Firefox < 83.,NETWORK,LOW,NONE,HIGH,NONE,6.5,MEDIUM,NULL,NULL,83.0,
Firefox,CVE-2020-26964,"Si la funcionalidad Remote Debugging via USB estaba habilitada en Firefox para Android en una versión de Android anterior a Android 6.0, las aplicaciones no confiables podrían haberse conectado a la funcionalidad y operar con los privilegios del navegador para leer e interactuar con el contenido web.&#xa0;La funcionalidad fue implementada como un socket de dominio Unix, protegido por la política SELinux de Android;&#xa0;sin embargo, SELinux no se aplicó para versiones anteriores a 6.0.&#xa0;Esto se corrigió al eliminar la funcionalidad Remote Debugging via USB de los dispositivos afectados.&#xa0;*Nota: este problema solo afectó a Firefox para Android.&#xa0;Otros sistemas operativos no están afectados.*.&#xa0;Esta vulnerabilidad afecta a Firefox versiones anteriores a 83","If the Remote Debugging via USB feature was enabled in Firefox for Android on an Android version prior to Android 6.0, untrusted apps could have connected to the feature and operated with the privileges of the browser to read and interact with web content. The feature was implemented as a unix domain socket, protected by the Android SELinux policy; however, SELinux was not enforced for versions prior to 6.0. This was fixed by removing the Remote Debugging via USB feature from affected devices. *Note: This issue only affected Firefox for Android. Other operating systems are unaffected.*. This vulnerability affects Firefox < 83.",NETWORK,HIGH,HIGH,HIGH,NONE,6.8,MEDIUM,NULL,NULL,83.0,
Firefox,CVE-2020-26975,"Cuando una aplicación maliciosa instalada en el dispositivo del usuario transmitió un Intent a Firefox para Android, se podrían haber especificado encabezados arbitrarios, conllevando a ataques como abuso de autoridad ambiental o fijación de sesiones.&#xa0;Esto se resolvió permitiendo solo determinados encabezados en la lista segura.&#xa0;*Nota: este problema solo afectó a Firefox para Android.&#xa0;Otros sistemas operativos no están afectados.*.&#xa0;Esta vulnerabilidad afecta a Firefox versiones anteriores a 84","When a malicious application installed on the user's device broadcast an Intent to Firefox for Android, arbitrary headers could have been specified, leading to attacks such as abusing ambient authority or session fixation. This was resolved by only allowing certain safe-listed headers. *Note: This issue only affected Firefox for Android. Other operating systems are unaffected.*. This vulnerability affects Firefox < 84.",NETWORK,LOW,NONE,HIGH,NONE,6.5,MEDIUM,NULL,NULL,84.0,
Firefox,CVE-2020-26977,"Al intentar conectar un sitio web usando un puerto que no responde, un atacante podría haber controlado el contenido de una pestaña mientras la barra de URL mostraba el dominio original.&#xa0;*Nota: este problema solo afecta a Firefox para Android.&#xa0;Otros sistemas operativos no están afectados.*.&#xa0;Esta vulnerabilidad afecta a Firefox versiones anteriores a 84","By attempting to connect a website using an unresponsive port, an attacker could have controlled the content of a tab while the URL bar displayed the original domain. *Note: This issue only affects Firefox for Android. Other operating systems are unaffected.*. This vulnerability affects Firefox < 84.",NETWORK,LOW,NONE,HIGH,NONE,6.5,MEDIUM,NULL,NULL,84.0,
Firefox,CVE-2021-23976,"Cuando se acepta una intención maliciosa de otras aplicaciones instaladas, Firefox para Android aceptó manifiestos de rutas de archivos arbitrarias y permitió declarar manifiestos de aplicaciones web para otros orígenes.&#xa0;Esto podría usarse para conseguir acceso a pantalla completa para la suplantación de la interfaz de usuario y también podría conllevar a ataques de origen cruzado en sitios web específicos.&#xa0;Nota: Este problema es diferente de CVE-2020-26954 y solo afecta a Firefox para Android.&#xa0;Otros sistemas operativos no están afectados.&#xa0;Esta vulnerabilidad afecta a Firefox versiones anteriores a 86","When accepting a malicious intent from other installed apps, Firefox for Android accepted manifests from arbitrary file paths and allowed declaring webapp manifests for other origins. This could be used to gain fullscreen access for UI spoofing and could also lead to cross-origin attacks on targeted websites. Note: This issue is a different issue from CVE-2020-26954 and only affected Firefox for Android. Other operating systems are unaffected. This vulnerability affects Firefox < 86.",NETWORK,LOW,HIGH,HIGH,NONE,8.1,HIGH,NULL,NULL,86.0,
Firefox,CVE-2021-23957,"Las navegaciones por medio del esquema de URL ""intent"" específico de Android podrían haber sido usado inapropiadamente para escapar del sandbox de iframe.&#xa0;Nota: este problema solo afectó a Firefox para Android.&#xa0;Otros sistemas operativos no están afectados.&#xa0;Esta vulnerabilidad afecta a Firefox versiones anteriores a 85",Navigations through the Android-specific `intent` URL scheme could have been misused to escape iframe sandbox. Note: This issue only affected Firefox for Android. Other operating systems are unaffected. This vulnerability affects Firefox < 85.,NETWORK,LOW,NONE,HIGH,NONE,7.4,HIGH,NULL,NULL,85.0,
Firefox,CVE-2021-23959,"Un bug de tipo XSS en las páginas de error internas podría conllevar a varios ataques de suplantación de identidad, incluyendo otras páginas de error y la barra de direcciones.&#xa0;Nota: este problema solo afectó a Firefox para Android.&#xa0;Otros sistemas operativos no están afectados.&#xa0;Esta vulnerabilidad afecta a Firefox versiones anteriores a 85","An XSS bug in internal error pages could have led to various spoofing attacks, including other error pages and the address bar. Note: This issue only affected Firefox for Android. Other operating systems are unaffected. This vulnerability affects Firefox < 85.",NETWORK,LOW,LOW,LOW,NONE,6.1,MEDIUM,NULL,NULL,85.0,
Firefox,CVE-2021-23977,Firefox para Android sufrió una vulnerabilidad de tipo time-of-check-time-of-use que permitía a una aplicación maliciosa leer datos confidenciales desde los directorios de la  aplicación.&#xa0;Nota: este problema solo afecta a Firefox para Android.&#xa0;Otros sistemas operativos no están afectados.&#xa0;Esta vulnerabilidad afecta a Firefox versiones anteriores a 86,Firefox for Android suffered from a time-of-check-time-of-use vulnerability that allowed a malicious application to read sensitive data from application directories. Note: This issue is only affected Firefox for Android. Other operating systems are unaffected. This vulnerability affects Firefox < 86.,NETWORK,HIGH,HIGH,NONE,NONE,5.3,MEDIUM,NULL,NULL,86.0,
Firefox,CVE-2021-29952,"Cuando se destruían los componentes de Web Render, una condición de carrera podría haber causado un comportamiento indefinido, y presumimos que con suficiente esfuerzo podría haber sido explotable para ejecutar código arbitrario. Esta vulnerabilidad afecta a Firefox versiones anteriores a 88.0.1 y a Firefox para Android versiones anteriores a 88.1.3","When Web Render components were destructed, a race condition could have caused undefined behavior, and we presume that with enough effort may have been exploitable to run arbitrary code. This vulnerability affects Firefox < 88.0.1 and Firefox for Android < 88.1.3.",NETWORK,HIGH,HIGH,HIGH,HIGH,7.5,HIGH,NULL,NULL,88.1.3,
Firefox,CVE-2021-29953,"Una página web maliciosa podría haber forzado a un usuario de Firefox para Android a ejecutar JavaScript controlado por el atacante en el contexto de otro dominio, resultando en una vulnerabilidad de tipo Universal Cross-Site Scripting . *Nota: Este problema sólo afecta a Firefox para Android. Otros sistemas operativos no están afectados. Se están reteniendo temporalmente más detalles para dar a usuarios la oportunidad de actualizarse. Esta vulnerabilidad afecta a Firefox versiones anteriores a 88.0.1 y a Firefox para Android versiones anteriores a 88.1.3","A malicious webpage could have forced a Firefox for Android user into executing attacker-controlled JavaScript in the context of another domain, resulting in a Universal Cross-Site Scripting vulnerability. *Note: This issue only affected Firefox for Android. Other operating systems are unaffected. Further details are being temporarily withheld to allow users an opportunity to update.*. This vulnerability affects Firefox < 88.0.1 and Firefox for Android < 88.1.3.",NETWORK,LOW,LOW,LOW,NONE,6.1,MEDIUM,NULL,NULL,88.1.3,
Firefox,CVE-2021-29962,Firefox para Android se volvía inestable y difícil de recuperar cuando un sitio web abría demasiadas ventanas emergentes. *Este bug sólo afecta a Firefox para Android. Otros sistemas operativos no están afectados.*. Esta vulnerabilidad afecta a Firefox versiones anteriores a 89,Firefox for Android would become unstable and hard-to-recover when a website opened too many popups. *This bug only affects Firefox for Android. Other operating systems are unaffected.*. This vulnerability affects Firefox < 89.,NETWORK,LOW,NONE,NONE,LOW,4.3,MEDIUM,NULL,NULL,89.0,
Firefox,CVE-2021-29963,Las sugerencias de búsqueda de la barra de direcciones en el modo de navegación privada reusaban los datos de la sesión del modo normal. *Este bug sólo afecta a Firefox para Android. Otros sistemas operativos no están afectados*. Esta vulnerabilidad afecta a Firefox versiones anteriores a 89,Address bar search suggestions in private browsing mode were re-using session data from normal mode. *This bug only affects Firefox for Android. Other operating systems are unaffected.*. This vulnerability affects Firefox < 89.,NETWORK,LOW,NONE,LOW,NONE,4.3,MEDIUM,NULL,NULL,89.0,
Firefox,CVE-2021-29965,Un sitio web malicioso que causa que se genere un diálogo de autenticación HTTP podría engañar al gestor de contraseñas integrado para sugerir contraseñas para el sitio web actualmente activo en lugar del sitio web que desencadenó el diálogo. *Este bug sólo afecta a Firefox para Android. Otros sistemas operativos no están afectados. Esta vulnerabilidad afecta a Firefox versiones anteriores a 89,A malicious website that causes an HTTP Authentication dialog to be spawned could trick the built-in password manager to suggest passwords for the currently active website instead of the website that triggered the dialog. *This bug only affects Firefox for Android. Other operating systems are unaffected.*. This vulnerability affects Firefox < 89.,NETWORK,LOW,NONE,LOW,NONE,5.3,MEDIUM,NULL,NULL,89.0,
Firefox,CVE-2021-29971,"Si un usuario ha concedido un permiso a una página web y ha guardado esa concesión, cualquier página web que se ejecute en el mismo host -independientemente del esquema o del puerto- recibirá ese permiso. *Este bug sólo afecta a Firefox para Android. Otros sistemas operativos no se ven afectados*. Esta vulnerabilidad afecta a Firefox versiones anteriores a 90","If a user had granted a permission to a webpage and saved that grant, any webpage running on the same host - irrespective of scheme or port - would be granted that permission. *This bug only affects Firefox for Android. Other operating systems are unaffected.*. This vulnerability affects Firefox < 90.",NETWORK,LOW,HIGH,HIGH,HIGH,9.8,CRITICAL,NULL,NULL,90.0,
Firefox,CVE-2021-29973,El autocompletado de contraseñas se activaba sin la interacción del usuario en sitios web no seguros en Firefox para Android. Esto fue corregido para requerir la interacción del usuario con la página antes de que la contraseña de un usuario fuera introducida por la funcionalidad autofill del navegador *Este bug solo afecta a Firefox para Android. Otros sistemas operativos no están afectados*. Esta vulnerabilidad afecta a Firefox versiones anteriores a 90,Password autofill was enabled without user interaction on insecure websites on Firefox for Android. This was corrected to require user interaction with the page before a user's password would be entered by the browser's autofill functionality *This bug only affects Firefox for Android. Other operating systems are unaffected.*. This vulnerability affects Firefox < 90.,NETWORK,LOW,HIGH,HIGH,HIGH,8.8,HIGH,NULL,NULL,90.0,
Firefox,CVE-2021-29993,"Firefox para Android permitía una navegación mediante el protocolo ""intent://"", lo que podía ser usado para causar bloqueos y falsificaciones de la Interfaz de Usuario. *Este bug sólo afecta a Firefox para Android. Otros sistemas operativos no están afectados*. Esta vulnerabilidad afecta a Firefox versiones anteriores a 92","Firefox for Android allowed navigations through the `intent://` protocol, which could be used to cause crashes and UI spoofs. *This bug only affects Firefox for Android. Other operating systems are unaffected.*. This vulnerability affects Firefox < 92.",NETWORK,LOW,NONE,HIGH,HIGH,8.1,HIGH,NULL,NULL,92.0,
Firefox,CVE-2022-26485,"La eliminación de un parámetro XSLT durante el procesamiento podría haber dado lugar a un use-after-free explotable. Hemos recibido informes de ataques en la naturaleza que abusan de esta falla. Esta vulnerabilidad afecta a Firefox &lt; 97.0.2, Firefox ESR &lt; 91.6.1, Firefox para Android &lt; 97.3.0, Thunderbird &lt; 91.6.2 y Focus &lt; 97.3.0.","Removing an XSLT parameter during processing could have lead to an exploitable use-after-free. We have had reports of attacks in the wild abusing this flaw. This vulnerability affects Firefox < 97.0.2, Firefox ESR < 91.6.1, Firefox for Android < 97.3.0, Thunderbird < 91.6.2, and Focus < 97.3.0.",NETWORK,LOW,HIGH,HIGH,HIGH,8.8,HIGH,NULL,NULL,97.3.0,
Firefox,CVE-2022-26486,"Un mensaje inesperado en el framework IPC de WebGPU podría provocar un escape de la sandbox explotable y de use-after-free. Hemos recibido informes de ataques en la naturaleza que abusan de esta falla. Esta vulnerabilidad afecta a Firefox &lt; 97.0.2, Firefox ESR &lt; 91.6.1, Firefox para Android &lt; 97.3.0, Thunderbird &lt; 91.6.2 y Focus &lt; 97.3.0.","An unexpected message in the WebGPU IPC framework could lead to a use-after-free and exploitable sandbox escape. We have had reports of attacks in the wild abusing this flaw. This vulnerability affects Firefox < 97.0.2, Firefox ESR < 91.6.1, Firefox for Android < 97.3.0, Thunderbird < 91.6.2, and Focus < 97.3.0.",NETWORK,LOW,HIGH,HIGH,HIGH,9.6,CRITICAL,NULL,NULL,97.3.0,
Firefox,CVE-2022-38474,Un sitio web que tuviera permiso para acceder al micrófono podría grabar audio sin que se mostrara la notificación de audio. Este error no permite que el atacante omita la solicitud de permiso; solo afecta la notificación que se muestra una vez que se ha otorgado el permiso.<br>*Este error solo afecta a Firefox para Android. Otros sistemas operativos no se ven afectados.*. Esta vulnerabilidad afecta a Firefox &lt; 104.,A website that had permission to access the microphone could record audio without the audio notification being shown. This bug does not allow the attacker to bypass the permission prompt - it only affects the notification shown once permission has been granted.<br />*This bug only affects Firefox for Android. Other operating systems are unaffected.*. This vulnerability affects Firefox < 104.,NETWORK,LOW,NONE,LOW,NONE,4.3,MEDIUM,NULL,NULL,104.0,
Firefox,CVE-2023-23600,Descripcion no disponible,Per origin notification permissions were being stored in a way that didn't take into account what browsing context the permission was granted in. This lead to the possibility of notifications to be displayed during different browsing sessions.<br>*This bug only affects Firefox for Android. Other operating systems are unaffected.*. This vulnerability affects Firefox < 109.,NETWORK,LOW,HIGH,NONE,NONE,6.5,MEDIUM,NULL,NULL,109.0,
Firefox,CVE-2023-25748,Descripcion no disponible,"By displaying a prompt with a long description, the fullscreen notification could have been hidden, resulting in potential user confusion or spoofing attacks. <br>*This bug only affects Firefox for Android. Other operating systems are unaffected.*. This vulnerability affects Firefox < 111.",NETWORK,LOW,NONE,LOW,NONE,4.3,MEDIUM,NULL,NULL,111.0,
Firefox,CVE-2023-25749,Descripcion no disponible,"Android applications with unpatched vulnerabilities can be launched from a browser using Intents, exposing users to these vulnerabilities. Firefox will now confirm with users that they want to launch an external application before doing so. <br>*This bug only affects Firefox for Android. Other versions of Firefox are unaffected.*. This vulnerability affects Firefox < 111.",NETWORK,LOW,NONE,LOW,NONE,4.3,MEDIUM,NULL,NULL,111.0,
Firefox,CVE-2023-28159,Descripcion no disponible,"The fullscreen notification could have been hidden on Firefox for Android by using download popups, resulting in potential user confusion or spoofing attacks. <br>*This bug only affects Firefox for Android. Other operating systems are unaffected.*. This vulnerability affects Firefox < 111.",NETWORK,LOW,NONE,LOW,NONE,4.3,MEDIUM,NULL,NULL,111.0,
