APP,CVE ID,Spanish Description,English Description,AccessVector,Attack Complexity,Confidentiality Impact,Integrity Impact,Availability Impact,Base Score,Base Severity,Exploitability Score,Impact Score,Version End Excluding,Version End Including
Firefox,CVE-2023-29533,Descripcion no disponible,"A website could have obscured the fullscreen notification by using a combination of <code>window.open</code>, fullscreen requests, <code>window.name</code> assignments, and <code>setInterval</code> calls. This could have led to user confusion and possible spoofing attacks. This vulnerability affects Firefox < 112, Focus for Android < 112, Firefox ESR < 102.10, Firefox for Android < 112, and Thunderbird < 102.10.",NETWORK,LOW,NONE,LOW,NONE,4.3,MEDIUM,NULL,NULL,112.0,
Firefox,CVE-2023-29535,Descripcion no disponible,"Following a Garbage Collector compaction, weak maps may have been accessed before they were correctly traced. This resulted in memory corruption and a potentially exploitable crash. This vulnerability affects Firefox < 112, Focus for Android < 112, Firefox ESR < 102.10, Firefox for Android < 112, and Thunderbird < 102.10.",NETWORK,LOW,NONE,NONE,HIGH,6.5,MEDIUM,NULL,NULL,112.0,
Firefox,CVE-2023-29536,Descripcion no disponible,"An attacker could cause the memory manager to incorrectly free a pointer that addresses attacker-controlled memory, resulting in an assertion, memory corruption, or a potentially exploitable crash. This vulnerability affects Firefox < 112, Focus for Android < 112, Firefox ESR < 102.10, Firefox for Android < 112, and Thunderbird < 102.10.",NETWORK,LOW,HIGH,HIGH,HIGH,8.8,HIGH,NULL,NULL,112.0,
Firefox,CVE-2023-29537,Descripcion no disponible,"Multiple race conditions in the font initialization could have led to memory corruption and execution of attacker-controlled code. This vulnerability affects Firefox for Android < 112, Firefox < 112, and Focus for Android < 112.",NETWORK,HIGH,HIGH,HIGH,HIGH,7.5,HIGH,NULL,NULL,112.0,
Firefox,CVE-2023-29538,Descripcion no disponible,"Under specific circumstances a WebExtension may have received a <code>jar:file:///</code> URI instead of a <code>moz-extension:///</code> URI during a load request. This leaked directory paths on the user's machine. This vulnerability affects Firefox for Android < 112, Firefox < 112, and Focus for Android < 112.",NETWORK,LOW,LOW,NONE,NONE,4.3,MEDIUM,NULL,NULL,112.0,
Firefox,CVE-2023-29539,Descripcion no disponible,"When handling the filename directive in the Content-Disposition header, the filename would be truncated if the filename contained a NULL character. This could have led to reflected file download attacks potentially tricking users to install malware. This vulnerability affects Firefox < 112, Focus for Android < 112, Firefox ESR < 102.10, Firefox for Android < 112, and Thunderbird < 102.10.",NETWORK,LOW,HIGH,HIGH,HIGH,8.8,HIGH,NULL,NULL,112.0,
Firefox,CVE-2023-29540,Descripcion no disponible,"Using a redirect embedded into <code>sourceMappingUrls</code> could allow for navigation to external protocol links in sandboxed iframes without <code>allow-top-navigation-to-custom-protocols</code>. This vulnerability affects Firefox for Android < 112, Firefox < 112, and Focus for Android < 112.",NETWORK,LOW,LOW,LOW,NONE,6.1,MEDIUM,NULL,NULL,112.0,
Firefox,CVE-2023-29541,Descripcion no disponible,"Firefox did not properly handle downloads of files ending in <code>.desktop</code>, which can be interpreted to run attacker-controlled commands. <br>*This bug only affects Firefox for Linux on certain Distributions. Other operating systems are unaffected, and Mozilla is unable to enumerate all affected Linux Distributions.*. This vulnerability affects Firefox < 112, Focus for Android < 112, Firefox ESR < 102.10, Firefox for Android < 112, and Thunderbird < 102.10.",NETWORK,LOW,HIGH,HIGH,HIGH,8.8,HIGH,NULL,NULL,112.0,
Firefox,CVE-2023-29543,Descripcion no disponible,"An attacker could have caused memory corruption and a potentially exploitable use-after-free of a pointer in a global object's debugger vector. This vulnerability affects Firefox for Android < 112, Firefox < 112, and Focus for Android < 112.",NETWORK,LOW,HIGH,HIGH,HIGH,8.8,HIGH,NULL,NULL,112.0,
Firefox,CVE-2023-29544,Descripcion no disponible,"If multiple instances of resource exhaustion occurred at the incorrect time, the garbage collector could have caused memory corruption and a potentially exploitable crash. This vulnerability affects Firefox for Android < 112, Firefox < 112, and Focus for Android < 112.",NETWORK,LOW,NONE,NONE,HIGH,6.5,MEDIUM,NULL,NULL,112.0,
Firefox,CVE-2023-29548,Descripcion no disponible,"A wrong lowering instruction in the ARM64 Ion compiler resulted in a wrong optimization result. This vulnerability affects Firefox < 112, Focus for Android < 112, Firefox ESR < 102.10, Firefox for Android < 112, and Thunderbird < 102.10.",NETWORK,LOW,NONE,HIGH,NONE,6.5,MEDIUM,NULL,NULL,112.0,
Firefox,CVE-2023-29549,Descripcion no disponible,"Under certain circumstances, a call to the <code>bind</code> function may have resulted in the incorrect realm. This may have created a vulnerability relating to JavaScript-implemented sandboxes such as SES. This vulnerability affects Firefox for Android < 112, Firefox < 112, and Focus for Android < 112.",NETWORK,LOW,NONE,HIGH,NONE,6.5,MEDIUM,NULL,NULL,112.0,
Firefox,CVE-2023-29550,Descripcion no disponible,"Memory safety bugs present in Firefox 111 and Firefox ESR 102.9. Some of these bugs showed evidence of memory corruption and we presume that with enough effort some of these could have been exploited to run arbitrary code. This vulnerability affects Firefox < 112, Focus for Android < 112, Firefox ESR < 102.10, Firefox for Android < 112, and Thunderbird < 102.10.",NETWORK,LOW,HIGH,HIGH,HIGH,8.8,HIGH,NULL,NULL,112.0,
Firefox,CVE-2023-29551,Descripcion no disponible,"Memory safety bugs present in Firefox 111. Some of these bugs showed evidence of memory corruption and we presume that with enough effort some of these could have been exploited to run arbitrary code. This vulnerability affects Firefox for Android < 112, Firefox < 112, and Focus for Android < 112.",NETWORK,LOW,HIGH,HIGH,HIGH,8.8,HIGH,NULL,NULL,112.0,
Firefox,CVE-2023-25747,Descripcion no disponible,"A potential use-after-free in libaudio was fixed by disabling the AAudio backend when running on Android API below version 30.
*This bug only affects Firefox for Android. Other versions of Firefox are unaffected.* This vulnerability affects Firefox for Android < 110.1.0.",NETWORK,LOW,NONE,NONE,HIGH,7.5,HIGH,NULL,NULL,110.1,
Firefox,CVE-2023-29534,Descripcion no disponible,"Different techniques existed to obscure the fullscreen notification in Firefox and Focus for Android.  These could have led to potential user confusion and spoofing attacks.

*This bug only affects Firefox and Focus for Android. Other versions of Firefox are unaffected.* This vulnerability affects Firefox for Android < 112 and Focus for Android < 112.

",NETWORK,LOW,HIGH,HIGH,NONE,9.1,CRITICAL,NULL,NULL,112.0,
Firefox,CVE-2023-29546,Descripcion no disponible,"When recording the screen while in Private Browsing on Firefox for Android the address bar and keyboard were not hidden, potentially leaking sensitive information. 

*This bug only affects Firefox for Android. Other operating systems are unaffected.* This vulnerability affects Firefox for Android < 112 and Focus for Android < 112.

",NETWORK,LOW,HIGH,NONE,NONE,6.5,MEDIUM,NULL,NULL,112.0,
Microsoft Teams,CVE-2022-21965,Una Vulnerabilidad de Denegación de Servicio en Microsoft Teams,Microsoft Teams Denial of Service Vulnerability,NETWORK,LOW,NONE,NONE,HIGH,7.5,HIGH,NULL,NULL,,
Microsoft Teams,CVE-2023-29328,Descripcion no disponible,Microsoft Teams Remote Code Execution Vulnerability,NETWORK,LOW,HIGH,HIGH,HIGH,8.8,HIGH,NULL,NULL,1.0.0.2023070204,
Microsoft Teams,CVE-2023-29330,Descripcion no disponible,Microsoft Teams Remote Code Execution Vulnerability,NETWORK,LOW,HIGH,HIGH,HIGH,8.8,HIGH,NULL,NULL,1.0.0.2023070204,
Authenticator,CVE-2022-35290,"En determinadas condiciones, SAP Authenticator para Android permite a un atacante acceder a información que de otro modo estaría restringida",Under certain conditions SAP Authenticator for Android allows an attacker to access information which would otherwise be restricted.,NETWORK,LOW,HIGH,NONE,NONE,7.5,HIGH,NULL,NULL,1.2.17,
